code,libelle,niveau
66.11,Administration de marchés financiers,classe
66.12,Courtage de valeurs mobilières et de marchandises,classe
66.19,"Autres activités auxiliaires de services financiers, hors assurance et caisses de retraite",classe
66.21,Évaluation des risques et dommages,classe
66.22,Activités des agents et courtiers d'assurances,classe
66.29,Autres activités auxiliaires d'assurance et de caisses de retraite,classe
66.3,Gestion de fonds,classe
68.1,Activités des marchands de biens immobiliers,classe
68.2,Location et exploitation de biens immobiliers propres ou loués,classe
68.31,Agences immobilières,classe
68.32,Administration de biens immobiliers,classe
69.1,Activités juridiques,classe
69.2,Activités comptables,classe
70.1,Activités des sièges sociaux,classe
70.21,Conseil en relations publiques et communication,classe
70.22,Conseil pour les affaires et autres conseils de gestion,classe
71.11,Activités d'architecture,classe
71.12,Activités d'ingénierie,classe
71.2,Activités de contrôle et analyses techniques,classe
72.11,Recherche-développement en biotechnologie,classe
72.19,Recherche-développement en autres sciences physiques et naturelles,classe
72.2,Recherche-développement en sciences humaines et sociales,classe
73.11,Activités des agences de publicité,classe
73.12,Régie publicitaire de médias,classe
73.2,Études de marché et sondages,classe
74.1,Activités spécialisées de design,classe
74.2,Activités photographiques,classe
74.3,Traduction et interprétation,classe
74.9,"Autres activités spécialisées, scientifiques et techniques n.c.a.",classe
75,Activités vétérinaires,classe
77.11,Location et location-bail de voitures et de véhicules automobiles légers,classe
77.12,Location et location-bail de camions,classe
77.21,Location et location-bail d'articles de loisirs et de sport,classe
77.22,Location de vidéocassettes et disques vidéo,classe
77.29,Location et location-bail d'autres biens personnels et domestiques,classe
77.31,Location et location-bail de machines et équipements agricoles,classe
77.32,Location et location-bail de machines et équipements pour la construction,classe
77.33,Location et location-bail de machines de bureau et de matériel informatique,classe
77.34,Location et location-bail de matériels de transport par eau,classe
77.35,Location et location-bail de matériels de transport aérien,classe
77.39,"Location et location-bail d'autres machines, équipements et biens matériels n.c.a.",classe
77.4,"Location-bail de propriété intellectuelle et de produits similaires, à l'exception des œuvres soumises à copyright",classe
78.1,Activités des agences de placement de main-d'œuvre,classe
78.2,Activités des agences de travail temporaire,classe
78.3,Autre mise à disposition de ressources humaines,classe
79.11,Activités des agences de voyage,classe
79.12,Activités des voyagistes,classe
79.9,Autres services de réservation et activités connexes,classe
80.1,Activités de sécurité privée,classe
80.2,Activités liées aux systèmes de sécurité,classe
80.3,Activités d'enquête,classe
81.1,Activités combinées de soutien lié aux bâtiments,classe
81.21,Nettoyage courant des bâtiments,classe
81.22,Autres activités de nettoyage des bâtiments et nettoyage industriel,classe
81.29,Autres activités de nettoyage,classe
81.3,Services d'aménagement paysager,classe
82.11,Services administratifs combinés de bureau,classe
82.19,"Photocopie, préparation de documents et autres activités spécialisées de soutien de bureau",classe
82.2,Activités de centres d'appels,classe
82.3,Organisation de salons professionnels et congrès,classe
82.91,Activités des agences de recouvrement de factures et des sociétés d'information financière sur la clientèle,classe
82.92,Activités de conditionnement,classe
82.99,Autres activités de soutien aux entreprises n.c.a.,classe
84.11,Administration publique générale,classe
84.12,"Administration publique (tutelle) de la santé, de la formation, de la culture et des services sociaux, autre que sécurité sociale",classe
84.13,Administration publique (tutelle) des activités économiques,classe
84.21,Affaires étrangères,classe
84.22,Défense,classe
84.23,Justice,classe
84.24,Activités d'ordre public et de sécurité,classe
84.25,Services du feu et de secours,classe
84.3,Sécurité sociale obligatoire,classe
85.1,Enseignement pré-primaire,classe
85.2,Enseignement primaire,classe
85.31,Enseignement secondaire général,classe
85.32,Enseignement secondaire technique ou professionnel,classe
85.41,Enseignement post-secondaire non supérieur,classe
85.42,Enseignement supérieur,classe
85.51,Enseignement de disciplines sportives et d'activités de loisirs,classe
85.52,Enseignement culturel,classe
85.53,Enseignement de la conduite,classe
85.59,Enseignements divers,classe
85.6,Activités de soutien à l'enseignement,classe
86.1,Activités hospitalières,classe
86.21,Activité des médecins généralistes,classe
86.22,Activité des médecins spécialistes,classe
86.23,Pratique dentaire,classe
86.9,Autres activités pour la santé humaine,classe
87.1,Hébergement médicalisé,classe
87.2,"Hébergement social pour personnes handicapées mentales, malades mentales et toxicomanes",classe
87.3,Hébergement social pour personnes âgées ou handicapées physiques,classe
87.9,Autres activités d'hébergement social,classe
88.1,Action sociale sans hébergement pour personnes âgées et pour personnes handicapées,classe
88.91,Action sociale sans hébergement pour jeunes enfants,classe
88.99,Autre action sociale sans hébergement n.c.a.,classe
90.01,Arts du spectacle vivant,classe
90.02,Activités de soutien au spectacle vivant,classe
90.03,Création artistique,classe
90.04,Gestion de salles de spectacles,classe
91.01,Gestion des bibliothèques et des archives,classe
91.02,Gestion des musées,classe
91.03,Gestion des sites et monuments historiques et des attractions touristiques similaires,classe
91.04,Gestion des jardins botaniques et zoologiques et des réserves naturelles,classe
92,Organisation de jeux de hasard et d'argent,classe
93.11,Gestion d'installations sportives,classe
93.12,Activités de clubs de sports,classe
93.13,Activités des centres de culture physique,classe
93.19,Autres activités liées au sport,classe
93.21,Activités des parcs d'attractions et parcs à thèmes,classe
93.29,Autres activités récréatives et de loisirs,classe
94.11,Activités des organisations patronales et consulaires,classe
94.12,Activités des organisations professionnelles,classe
94.2,Activités des syndicats de salariés,classe
94.91,Activités des organisations religieuses,classe
94.92,Activités des organisations politiques,classe
94.99,Activités des organisations associatives n.c.a.,classe
95.11,Réparation d'ordinateurs et d'équipements périphériques,classe
95.12,Réparation d'équipements de communication,classe
95.21,Réparation de produits électroniques grand public,classe
95.22,Réparation d'appareils électroménagers et d'équipements pour la maison et le jardin,classe
95.23,Réparation de chaussures et d'articles en cuir,classe
95.24,Réparation de meubles et d'équipements du foyer,classe
95.25,Réparation d'articles d'horlogerie et de bijouterie,classe
95.29,Réparation d'autres biens personnels et domestiques,classe
96.01,Blanchisserie-teinturerie,classe
96.02,Coiffure et soins de beauté,classe
96.03,Services funéraires,classe
96.04,Entretien corporel,classe
96.09,Autres services personnels n.c.a.,classe
97,Activités des ménages en tant qu'employeurs de personnel domestique,classe
98.1,Activités indifférenciées des ménages en tant que producteurs de biens pour usage propre,classe
98.2,Activités indifférenciées des ménages en tant que producteurs de services pour usage propre,classe
99,Activités des organisations et organismes extraterritoriaux,classe
01.11Z,"Culture de céréales (à l'exception du riz), de légumineuses et de graines oléagineuses",sousclasse
01.12Z,Culture du riz,sousclasse
01.13Z,"Culture de légumes, de melons, de racines et de tubercules",sousclasse
01.14Z,Culture de la canne à sucre,sousclasse
01.15Z,Culture du tabac,sousclasse
01.16Z,Culture de plantes à fibres,sousclasse
01.19Z,Autres cultures non permanentes,sousclasse
01.21Z,Culture de la vigne,sousclasse
01.22Z,Culture de fruits tropicaux et subtropicaux,sousclasse
01.23Z,Culture d'agrumes,sousclasse
01.24Z,Culture de fruits à pépins et à noyau,sousclasse
01.25Z,Culture d'autres fruits d'arbres ou d'arbustes et de fruits à coque,sousclasse
01.26Z,Culture de fruits oléagineux,sousclasse
01.27Z,Culture de plantes à boissons,sousclasse
01.28Z,"Culture de plantes à épices, aromatiques, médicinales et pharmaceutiques",sousclasse
01.29Z,Autres cultures permanentes,sousclasse
01.30Z,Reproduction de plantes,sousclasse
01.41Z,Élevage de vaches laitières,sousclasse
01.42Z,Élevage d'autres bovins et de buffles,sousclasse
01.43Z,Élevage de chevaux et d'autres équidés,sousclasse
01.44Z,Élevage de chameaux et d'autres camélidés,sousclasse
01.45Z,Élevage d'ovins et de caprins,sousclasse
01.46Z,Élevage de porcins,sousclasse
01.47Z,Élevage de volailles,sousclasse
01.49Z,Élevage d'autres animaux,sousclasse
01.50Z,Culture et élevage associés,sousclasse
01.61Z,Activités de soutien aux cultures,sousclasse
01.62Z,Activités de soutien à la production animale,sousclasse
01.63Z,Traitement primaire des récoltes,sousclasse
01.64Z,Traitement des semences,sousclasse
01.70Z,"Chasse, piégeage et services annexes",sousclasse
02.10Z,Sylviculture et autres activités forestières,sousclasse
02.20Z,Exploitation forestière,sousclasse
02.30Z,Récolte de produits forestiers non ligneux poussant à l'état sauvage,sousclasse
02.40Z,Services de soutien à l'exploitation forestière,sousclasse
03.11Z,Pêche en mer,sousclasse
03.12Z,Pêche en eau douce,sousclasse
03.21Z,Aquaculture en mer,sousclasse
03.22Z,Aquaculture en eau douce,sousclasse
05.10Z,Extraction de houille,sousclasse
05.20Z,Extraction de lignite,sousclasse
06.10Z,Extraction de pétrole brut,sousclasse
06.20Z,Extraction de gaz naturel,sousclasse
07.10Z,Extraction de minerais de fer,sousclasse
07.21Z,Extraction de minerais d'uranium et de thorium,sousclasse
07.29Z,Extraction d'autres minerais de métaux non ferreux,sousclasse
08.11Z,"Extraction de pierres ornementales et de construction, de calcaire industriel, de gypse, de craie et d'ardoise",sousclasse
08.12Z,"Exploitation de gravières et sablières, extraction d'argiles et de kaolin",sousclasse
08.91Z,Extraction des minéraux chimiques et d'engrais minéraux,sousclasse
08.92Z,Extraction de tourbe,sousclasse
08.93Z,Production de sel,sousclasse
08.99Z,Autres activités extractives n.c.a.,sousclasse
09.10Z,Activités de soutien à l'extraction d'hydrocarbures,sousclasse
09.90Z,Activités de soutien aux autres industries extractives,sousclasse
10.11Z,Transformation et conservation de la viande de boucherie,sousclasse
10.12Z,Transformation et conservation de la viande de volaille,sousclasse
10.13A,Préparation industrielle de produits à base de viande,sousclasse
10.13B,Charcuterie,sousclasse
10.20Z,"Transformation et conservation de poisson, de crustacés et de mollusques",sousclasse
10.31Z,Transformation et conservation de pommes de terre,sousclasse
10.32Z,Préparation de jus de fruits et légumes,sousclasse
10.39A,Autre transformation et conservation de légumes,sousclasse
10.39B,Transformation et conservation de fruits,sousclasse
10.41A,Fabrication d'huiles et graisses brutes,sousclasse
10.41B,Fabrication d'huiles et graisses raffinées,sousclasse
10.42Z,Fabrication de margarine et graisses comestibles similaires,sousclasse
10.51A,Fabrication de lait liquide et de produits frais,sousclasse
10.51B,Fabrication de beurre,sousclasse
10.51C,Fabrication de fromage,sousclasse
10.51D,Fabrication d'autres produits laitiers,sousclasse
10.52Z,Fabrication de glaces et sorbets,sousclasse
10.61A,Meunerie,sousclasse
10.61B,Autres activités du travail des grains,sousclasse
10.62Z,Fabrication de produits amylacés,sousclasse
10.71A,Fabrication industrielle de pain et de pâtisserie fraîche,sousclasse
10.71B,Cuisson de produits de boulangerie,sousclasse
10.71C,Boulangerie et boulangerie-pâtisserie,sousclasse
10.71D,Pâtisserie,sousclasse
10.72Z,"Fabrication de biscuits, biscottes et pâtisseries de conservation",sousclasse
10.73Z,Fabrication de pâtes alimentaires,sousclasse
10.81Z,Fabrication de sucre,sousclasse
10.82Z,"Fabrication de cacao, chocolat et de produits de confiserie",sousclasse
10.83Z,Transformation du thé et du café,sousclasse
10.84Z,Fabrication de condiments et assaisonnements,sousclasse
10.85Z,Fabrication de plats préparés,sousclasse
10.86Z,Fabrication d'aliments homogénéisés et diététiques,sousclasse
10.89Z,Fabrication d'autres produits alimentaires n.c.a.,sousclasse
10.91Z,Fabrication d'aliments pour animaux de ferme,sousclasse
10.92Z,Fabrication d'aliments pour animaux de compagnie,sousclasse
11.01Z,Production de boissons alcooliques distillées,sousclasse
11.02A,Fabrication de vins effervescents,sousclasse
11.02B,Vinification,sousclasse
11.03Z,Fabrication de cidre et de vins de fruits,sousclasse
11.04Z,Production d'autres boissons fermentées non distillées,sousclasse
11.05Z,Fabrication de bière,sousclasse
11.06Z,Fabrication de malt,sousclasse
11.07A,Industrie des eaux de table,sousclasse
11.07B,Production de boissons rafraîchissantes,sousclasse
12.00Z,Fabrication de produits à base de tabac,sousclasse
13.10Z,Préparation de fibres textiles et filature,sousclasse
13.20Z,Tissage,sousclasse
13.30Z,Ennoblissement textile,sousclasse
13.91Z,Fabrication d'étoffes à mailles,sousclasse
13.92Z,"Fabrication d'articles textiles, sauf habillement",sousclasse
13.93Z,Fabrication de tapis et moquettes,sousclasse
13.94Z,"Fabrication de ficelles, cordes et filets",sousclasse
13.95Z,"Fabrication de non-tissés, sauf habillement",sousclasse
13.96Z,Fabrication d'autres textiles techniques et industriels,sousclasse
13.99Z,Fabrication d'autres textiles n.c.a.,sousclasse
14.11Z,Fabrication de vêtements en cuir,sousclasse
14.12Z,Fabrication de vêtements de travail,sousclasse
14.13Z,Fabrication de vêtements de dessus,sousclasse
14.14Z,Fabrication de vêtements de dessous,sousclasse
14.19Z,Fabrication d'autres vêtements et accessoires,sousclasse
14.20Z,Fabrication d'articles en fourrure,sousclasse
14.31Z,Fabrication d'articles chaussants à mailles,sousclasse
14.39Z,Fabrication d'autres articles à mailles,sousclasse
15.11Z,Apprêt et tannage des cuirs ; préparation et teinture des fourrures,sousclasse
15.12Z,"Fabrication d'articles de voyage, de maroquinerie et de sellerie",sousclasse
15.20Z,Fabrication de chaussures,sousclasse
16.10A,"Sciage et rabotage du bois, hors imprégnation",sousclasse
16.10B,Imprégnation du bois,sousclasse
16.21Z,Fabrication de placage et de panneaux de bois,sousclasse
16.22Z,Fabrication de parquets assemblés,sousclasse
16.23Z,Fabrication de charpentes et d'autres menuiseries,sousclasse
16.24Z,Fabrication d'emballages en bois,sousclasse
16.29Z,"Fabrication d'objets divers en bois ; fabrication d'objets en liège, vannerie et sparterie",sousclasse
17.11Z,Fabrication de pâte à papier,sousclasse
17.12Z,Fabrication de papier et de carton,sousclasse
17.21A,Fabrication de carton ondulé,sousclasse
17.21B,Fabrication de cartonnages,sousclasse
17.21C,Fabrication d'emballages en papier,sousclasse
17.22Z,Fabrication d'articles en papier à usage sanitaire ou domestique,sousclasse
17.23Z,Fabrication d'articles de papeterie,sousclasse
17.24Z,Fabrication de papiers peints,sousclasse
17.29Z,Fabrication d'autres articles en papier ou en carton,sousclasse
18.11Z,Imprimerie de journaux,sousclasse
18.12Z,Autre imprimerie (labeur),sousclasse
18.13Z,Activités de pré-presse,sousclasse
18.14Z,Reliure et activités connexes,sousclasse
18.20Z,Reproduction d'enregistrements,sousclasse
19.10Z,Cokéfaction,sousclasse
19.20Z,Raffinage du pétrole,sousclasse
20.11Z,Fabrication de gaz industriels,sousclasse
20.12Z,Fabrication de colorants et de pigments,sousclasse
20.13A,Enrichissement et retraitement de matières nucléaires,sousclasse
20.13B,Fabrication d'autres produits chimiques inorganiques de base n.c.a.,sousclasse
20.14Z,Fabrication d'autres produits chimiques organiques de base,sousclasse
20.15Z,Fabrication de produits azotés et d'engrais,sousclasse
20.16Z,Fabrication de matières plastiques de base,sousclasse
20.17Z,Fabrication de caoutchouc synthétique,sousclasse
20.20Z,Fabrication de pesticides et d'autres produits agrochimiques,sousclasse
20.30Z,"Fabrication de peintures, vernis, encres et mastics",sousclasse
20.41Z,"Fabrication de savons, détergents et produits d'entretien",sousclasse
20.42Z,Fabrication de parfums et de produits pour la toilette,sousclasse
20.51Z,Fabrication de produits explosifs,sousclasse
20.52Z,Fabrication de colles,sousclasse
20.53Z,Fabrication d'huiles essentielles,sousclasse
20.59Z,Fabrication d'autres produits chimiques n.c.a.,sousclasse
20.60Z,Fabrication de fibres artificielles ou synthétiques,sousclasse
21.10Z,Fabrication de produits pharmaceutiques de base,sousclasse
21.20Z,Fabrication de préparations pharmaceutiques,sousclasse
22.11Z,Fabrication et rechapage de pneumatiques,sousclasse
22.19Z,Fabrication d'autres articles en caoutchouc,sousclasse
22.21Z,"Fabrication de plaques, feuilles, tubes et profilés en matières plastiques",sousclasse
22.22Z,Fabrication d'emballages en matières plastiques,sousclasse
22.23Z,Fabrication d'éléments en matières plastiques pour la construction,sousclasse
22.29A,Fabrication de pièces techniques à base de matières plastiques,sousclasse
22.29B,Fabrication de produits de consommation courante en matières plastiques,sousclasse
23.11Z,Fabrication de verre plat,sousclasse
23.12Z,Façonnage et transformation du verre plat,sousclasse
23.13Z,Fabrication de verre creux,sousclasse
23.14Z,Fabrication de fibres de verre,sousclasse
23.19Z,"Fabrication et façonnage d'autres articles en verre, y compris verre technique",sousclasse
23.20Z,Fabrication de produits réfractaires,sousclasse
23.31Z,Fabrication de carreaux en céramique,sousclasse
23.32Z,"Fabrication de briques, tuiles et produits de construction, en terre cuite",sousclasse
23.41Z,Fabrication d'articles céramiques à usage domestique ou ornemental,sousclasse
23.42Z,Fabrication d'appareils sanitaires en céramique,sousclasse
23.43Z,Fabrication d'isolateurs et pièces isolantes en céramique,sousclasse
23.44Z,Fabrication d'autres produits céramiques à usage technique,sousclasse
23.49Z,Fabrication d'autres produits céramiques,sousclasse
23.51Z,Fabrication de ciment,sousclasse
23.52Z,Fabrication de chaux et plâtre,sousclasse
23.61Z,Fabrication d'éléments en béton pour la construction,sousclasse
23.62Z,Fabrication d'éléments en plâtre pour la construction,sousclasse
23.63Z,Fabrication de béton prêt à l'emploi,sousclasse
23.64Z,Fabrication de mortiers et bétons secs,sousclasse
23.65Z,Fabrication d'ouvrages en fibre-ciment,sousclasse
23.69Z,"Fabrication d'autres ouvrages en béton, en ciment ou en plâtre",sousclasse
23.70Z,"Taille, façonnage et finissage de pierres",sousclasse
23.91Z,Fabrication de produits abrasifs,sousclasse
23.99Z,Fabrication d'autres produits minéraux non métalliques n.c.a.,sousclasse
24.10Z,Sidérurgie,sousclasse
24.20Z,"Fabrication de tubes, tuyaux, profilés creux et accessoires correspondants en acier",sousclasse
24.31Z,Étirage à froid de barres,sousclasse
24.32Z,Laminage à froid de feuillards,sousclasse
24.33Z,Profilage à froid par formage ou pliage,sousclasse
24.34Z,Tréfilage à froid,sousclasse
24.41Z,Production de métaux précieux,sousclasse
24.42Z,Métallurgie de l'aluminium,sousclasse
24.43Z,"Métallurgie du plomb, du zinc ou de l'étain",sousclasse
24.44Z,Métallurgie du cuivre,sousclasse
24.45Z,Métallurgie des autres métaux non ferreux,sousclasse
24.46Z,Élaboration et transformation de matières nucléaires,sousclasse
24.51Z,Fonderie de fonte,sousclasse
24.52Z,Fonderie d'acier,sousclasse
24.53Z,Fonderie de métaux légers,sousclasse
24.54Z,Fonderie d'autres métaux non ferreux,sousclasse
25.11Z,Fabrication de structures métalliques et de parties de structures,sousclasse
25.12Z,Fabrication de portes et fenêtres en métal,sousclasse
25.21Z,Fabrication de radiateurs et de chaudières pour le chauffage central,sousclasse
25.29Z,"Fabrication d'autres réservoirs, citernes et conteneurs métalliques",sousclasse
25.30Z,"Fabrication de générateurs de vapeur, à l'exception des chaudières pour le chauffage central",sousclasse
25.40Z,Fabrication d'armes et de munitions,sousclasse
25.50A,"Forge, estampage, matriçage ; métallurgie des poudres",sousclasse
25.50B,"Découpage, emboutissage",sousclasse
25.61Z,Traitement et revêtement des métaux,sousclasse
25.62A,Décolletage,sousclasse
25.62B,Mécanique industrielle,sousclasse
25.71Z,Fabrication de coutellerie,sousclasse
25.72Z,Fabrication de serrures et de ferrures,sousclasse
25.73A,Fabrication de moules et modèles,sousclasse
25.73B,Fabrication d'autres outillages,sousclasse
25.91Z,Fabrication de fûts et emballages métalliques similaires,sousclasse
25.92Z,Fabrication d'emballages métalliques légers,sousclasse
25.93Z,"Fabrication d'articles en fils métalliques, de chaînes et de ressorts",sousclasse
25.94Z,Fabrication de vis et de boulons,sousclasse
25.99A,Fabrication d'articles métalliques ménagers,sousclasse
25.99B,Fabrication d'autres articles métalliques,sousclasse
26.11Z,Fabrication de composants électroniques,sousclasse
26.12Z,Fabrication de cartes électroniques assemblées,sousclasse
26.20Z,Fabrication d'ordinateurs et d'équipements périphériques,sousclasse
26.30Z,Fabrication d'équipements de communication,sousclasse
26.40Z,Fabrication de produits électroniques grand public,sousclasse
26.51A,Fabrication d'équipements d'aide à la navigation,sousclasse
26.51B,Fabrication d'instrumentation scientifique et technique,sousclasse
26.52Z,Horlogerie,sousclasse
26.60Z,"Fabrication d'équipements d'irradiation médicale, d'équipements électromédicaux et électrothérapeutiques",sousclasse
26.70Z,Fabrication de matériels optique et photographique,sousclasse
26.80Z,Fabrication de supports magnétiques et optiques,sousclasse
27.11Z,"Fabrication de moteurs, génératrices et transformateurs électriques",sousclasse
27.12Z,Fabrication de matériel de distribution et de commande électrique,sousclasse
27.20Z,Fabrication de piles et d'accumulateurs électriques,sousclasse
27.31Z,Fabrication de câbles de fibres optiques,sousclasse
27.32Z,Fabrication d'autres fils et câbles électroniques ou électriques,sousclasse
27.33Z,Fabrication de matériel d'installation électrique,sousclasse
27.40Z,Fabrication d'appareils d'éclairage électrique,sousclasse
27.51Z,Fabrication d'appareils électroménagers,sousclasse
27.52Z,Fabrication d'appareils ménagers non électriques,sousclasse
27.90Z,Fabrication d'autres matériels électriques,sousclasse
28.11Z,"Fabrication de moteurs et turbines, à l'exception des moteurs d'avions et de véhicules",sousclasse
28.12Z,Fabrication d'équipements hydrauliques et pneumatiques,sousclasse
28.13Z,Fabrication d'autres pompes et compresseurs,sousclasse
28.14Z,Fabrication d'autres articles de robinetterie,sousclasse
28.15Z,Fabrication d'engrenages et d'organes mécaniques de transmission,sousclasse
28.21Z,Fabrication de fours et brûleurs,sousclasse
28.22Z,Fabrication de matériel de levage et de manutention,sousclasse
28.23Z,Fabrication de machines et d'équipements de bureau (à l'exception des ordinateurs et équipements périphériques),sousclasse
28.24Z,Fabrication d'outillage portatif à moteur incorporé,sousclasse
28.25Z,Fabrication d'équipements aérauliques et frigorifiques industriels,sousclasse
28.29A,"Fabrication d'équipements d'emballage, de conditionnement et de pesage",sousclasse
28.29B,Fabrication d'autres machines d'usage général,sousclasse
28.30Z,Fabrication de machines agricoles et forestières,sousclasse
28.41Z,Fabrication de machines-outils pour le travail des métaux,sousclasse
28.49Z,Fabrication d'autres machines-outils,sousclasse
28.91Z,Fabrication de machines pour la métallurgie,sousclasse
28.92Z,Fabrication de machines pour l'extraction ou la construction,sousclasse
28.93Z,Fabrication de machines pour l'industrie agro-alimentaire,sousclasse
28.94Z,Fabrication de machines pour les industries textiles,sousclasse
28.95Z,Fabrication de machines pour les industries du papier et du carton,sousclasse
28.96Z,Fabrication de machines pour le travail du caoutchouc ou des plastiques,sousclasse
28.99A,Fabrication de machines d'imprimerie,sousclasse
28.99B,Fabrication d'autres machines spécialisées,sousclasse
29.10Z,Construction de véhicules automobiles,sousclasse
29.20Z,Fabrication de carrosseries et remorques,sousclasse
29.31Z,Fabrication d'équipements électriques et électroniques automobiles,sousclasse
29.32Z,Fabrication d'autres équipements automobiles,sousclasse
30.11Z,Construction de navires et de structures flottantes,sousclasse
30.12Z,Construction de bateaux de plaisance,sousclasse
30.20Z,Construction de locomotives et d'autre matériel ferroviaire roulant,sousclasse
30.30Z,Construction aéronautique et spatiale,sousclasse
30.40Z,Construction de véhicules militaires de combat,sousclasse
30.91Z,Fabrication de motocycles,sousclasse
