code,libelle,niveau
10.52,Fabrication de glaces et sorbets,classe
10.61,Travail des grains,classe
10.62,Fabrication de produits amylacés,classe
10.71,Fabrication de pain et de pâtisserie fraîche,classe
10.72,"Fabrication de biscuits, biscottes et pâtisseries de conservation",classe
10.73,Fabrication de pâtes alimentaires,classe
10.81,Fabrication de sucre,classe
10.82,"Fabrication de cacao, chocolat et de produits de confiserie",classe
10.83,Transformation du thé et du café,classe
10.84,Fabrication de condiments et assaisonnements,classe
10.85,Fabrication de plats préparés,classe
10.86,Fabrication d'aliments homogénéisés et diététiques,classe
10.89,Fabrication d'autres produits alimentaires n.c.a.,classe
10.91,Fabrication d'aliments pour animaux de ferme,classe
10.92,Fabrication d'aliments pour animaux de compagnie,classe
11.01,Production de boissons alcooliques distillées,classe
11.02,Production de vin (de raisin),classe
11.03,Fabrication de cidre et de vins de fruits,classe
11.04,Production d'autres boissons fermentées non distillées,classe
11.05,Fabrication de bière,classe
11.06,Fabrication de malt,classe
11.07,Industrie des eaux minérales et autres eaux embouteillées et des boissons rafraîchissantes,classe
12,Fabrication de produits à base de tabac,classe
13.1,Préparation de fibres textiles et filature,classe
13.2,Tissage,classe
13.3,Ennoblissement textile,classe
13.91,Fabrication d'étoffes à mailles,classe
13.92,"Fabrication d'articles textiles, sauf habillement",classe
13.93,Fabrication de tapis et moquettes,classe
13.94,"Fabrication de ficelles, cordes et filets",classe
13.95,"Fabrication de non-tissés, sauf habillement",classe
13.96,Fabrication d'autres textiles techniques et industriels,classe
13.99,Fabrication d'autres textiles n.c.a.,classe
14.11,Fabrication de vêtements en cuir,classe
14.12,Fabrication de vêtements de travail,classe
14.13,Fabrication de vêtements de dessus,classe
14.14,Fabrication de vêtements de dessous,classe
14.19,Fabrication d'autres vêtements et accessoires,classe
14.2,Fabrication d'articles en fourrure,classe
14.31,Fabrication d'articles chaussants à mailles,classe
14.39,Fabrication d'autres articles à mailles,classe
15.11,Apprêt et tannage des cuirs ; préparation et teinture des fourrures,classe
15.12,"Fabrication d'articles de voyage, de maroquinerie et de sellerie",classe
15.2,Fabrication de chaussures,classe
16.1,Sciage et rabotage du bois,classe
16.21,Fabrication de placage et de panneaux de bois,classe
16.22,Fabrication de parquets assemblés,classe
16.23,Fabrication de charpentes et d'autres menuiseries,classe
16.24,Fabrication d'emballages en bois,classe
16.29,"Fabrication d'objets divers en bois ; fabrication d'objets en liège, vannerie et sparterie",classe
17.11,Fabrication de pâte à papier,classe
17.12,Fabrication de papier et de carton,classe
17.21,Fabrication de papier et carton ondulés et d'emballages en papier ou en carton,classe
17.22,Fabrication d'articles en papier à usage sanitaire ou domestique,classe
17.23,Fabrication d'articles de papeterie,classe
17.24,Fabrication de papiers peints,classe
17.29,Fabrication d'autres articles en papier ou en carton,classe
18.11,Imprimerie de journaux,classe
18.12,Autre imprimerie (labeur),classe
18.13,Activités de pré-presse,classe
18.14,Reliure et activités connexes,classe
18.2,Reproduction d'enregistrements,classe
19.1,Cokéfaction,classe
19.2,Raffinage du pétrole,classe
20.11,Fabrication de gaz industriels,classe
20.12,Fabrication de colorants et de pigments,classe
20.13,Fabrication d'autres produits chimiques inorganiques de base,classe
20.14,Fabrication d'autres produits chimiques organiques de base,classe
20.15,Fabrication de produits azotés et d'engrais,classe
20.16,Fabrication de matières plastiques de base,classe
20.17,Fabrication de caoutchouc synthétique,classe
20.2,Fabrication de pesticides et d'autres produits agrochimiques,classe
20.3,"Fabrication de peintures, vernis, encres et mastics",classe
20.41,"Fabrication de savons, détergents et produits d'entretien",classe
20.42,Fabrication de parfums et de produits pour la toilette,classe
20.51,Fabrication de produits explosifs,classe
20.52,Fabrication de colles,classe
20.53,Fabrication d'huiles essentielles,classe
20.59,Fabrication d'autres produits chimiques n.c.a.,classe
20.6,Fabrication de fibres artificielles ou synthétiques,classe
21.1,Fabrication de produits pharmaceutiques de base,classe
21.2,Fabrication de préparations pharmaceutiques,classe
22.11,Fabrication et rechapage de pneumatiques,classe
22.19,Fabrication d'autres articles en caoutchouc,classe
22.21,"Fabrication de plaques, feuilles, tubes et profilés en matières plastiques",classe
22.22,Fabrication d'emballages en matières plastiques,classe
22.23,Fabrication d'éléments en matières plastiques pour la construction,classe
22.29,Fabrication d'autres articles en matières plastiques,classe
23.11,Fabrication de verre plat,classe
23.12,Façonnage et transformation du verre plat,classe
23.13,Fabrication de verre creux,classe
23.14,Fabrication de fibres de verre,classe
23.19,"Fabrication et façonnage d'autres articles en verre, y compris verre technique",classe
23.2,Fabrication de produits réfractaires,classe
23.31,Fabrication de carreaux en céramique,classe
23.32,"Fabrication de briques, tuiles et produits de construction, en terre cuite",classe
23.41,Fabrication d'articles céramiques à usage domestique ou ornemental,classe
23.42,Fabrication d'appareils sanitaires en céramique,classe
23.43,Fabrication d'isolateurs et pièces isolantes en céramique,classe
23.44,Fabrication d'autres produits céramiques à usage technique,classe
23.49,Fabrication d'autres produits céramiques,classe
23.51,Fabrication de ciment,classe
23.52,Fabrication de chaux et plâtre,classe
23.61,Fabrication d'éléments en béton pour la construction,classe
23.62,Fabrication d'éléments en plâtre pour la construction,classe
23.63,Fabrication de béton prêt à l'emploi,classe
23.64,Fabrication de mortiers et bétons secs,classe
23.65,Fabrication d'ouvrages en fibre-ciment,classe
23.69,"Fabrication d'autres ouvrages en béton, en ciment ou en plâtre",classe
23.7,"Taille, façonnage et finissage de pierres",classe
23.91,Fabrication de produits abrasifs,classe
23.99,Fabrication d'autres produits minéraux non métalliques n.c.a.,classe
24.1,Sidérurgie,classe
24.2,"Fabrication de tubes, tuyaux, profilés creux et accessoires correspondants en acier",classe
24.31,Étirage à froid de barres,classe
24.32,Laminage à froid de feuillards,classe
24.33,Profilage à froid par formage ou pliage,classe
24.34,Tréfilage à froid,classe
24.41,Production de métaux précieux,classe
24.42,Métallurgie de l'aluminium,classe
24.43,"Métallurgie du plomb, du zinc ou de l'étain",classe
24.44,Métallurgie du cuivre,classe
24.45,Métallurgie des autres métaux non ferreux,classe
24.46,Élaboration et transformation de matières nucléaires,classe
24.51,Fonderie de fonte,classe
24.52,Fonderie d'acier,classe
24.53,Fonderie de métaux légers,classe
24.54,Fonderie d'autres métaux non ferreux,classe
25.11,Fabrication de structures métalliques et de parties de structures,classe
25.12,Fabrication de portes et fenêtres en métal,classe
25.21,Fabrication de radiateurs et de chaudières pour le chauffage central,classe
25.29,"Fabrication d'autres réservoirs, citernes et conteneurs métalliques",classe
25.3,"Fabrication de générateurs de vapeur, à l'exception des chaudières pour le chauffage central",classe
25.4,Fabrication d'armes et de munitions,classe
25.5,"Forge, emboutissage, estampage ; métallurgie des poudres",classe
25.61,Traitement et revêtement des métaux,classe
25.62,Usinage,classe
25.71,Fabrication de coutellerie,classe
25.72,Fabrication de serrures et de ferrures,classe
25.73,Fabrication d'outillage,classe
25.91,Fabrication de fûts et emballages métalliques similaires,classe
25.92,Fabrication d'emballages métalliques légers,classe
25.93,"Fabrication d'articles en fils métalliques, de chaînes et de ressorts",classe
25.94,Fabrication de vis et de boulons,classe
25.99,Fabrication d'autres produits métalliques n.c.a.,classe
26.11,Fabrication de composants électroniques,classe
26.12,Fabrication de cartes électroniques assemblées,classe
26.2,Fabrication d'ordinateurs et d'équipements périphériques,classe
26.3,Fabrication d'équipements de communication,classe
26.4,Fabrication de produits électroniques grand public,classe
26.51,"Fabrication d'instruments et d'appareils de mesure, d'essai et de navigation",classe
26.52,Horlogerie,classe
26.6,"Fabrication d'équipements d'irradiation médicale, d'équipements électromédicaux et électrothérapeutiques",classe
26.7,Fabrication de matériels optique et photographique,classe
26.8,Fabrication de supports magnétiques et optiques,classe
27.11,"Fabrication de moteurs, génératrices et transformateurs électriques",classe
27.12,Fabrication de matériel de distribution et de commande électrique,classe
27.2,Fabrication de piles et d'accumulateurs électriques,classe
27.31,Fabrication de câbles de fibres optiques,classe
27.32,Fabrication d'autres fils et câbles électroniques ou électriques,classe
27.33,Fabrication de matériel d'installation électrique,classe
27.4,Fabrication d'appareils d'éclairage électrique,classe
27.51,Fabrication d'appareils électroménagers,classe
27.52,Fabrication d'appareils ménagers non électriques,classe
27.9,Fabrication d'autres matériels électriques,classe
28.11,"Fabrication de moteurs et turbines, à l'exception des moteurs d'avions et de véhicules",classe
28.12,Fabrication d'équipements hydrauliques et pneumatiques,classe
28.13,Fabrication d'autres pompes et compresseurs,classe
28.14,Fabrication d'autres articles de robinetterie,classe
28.15,Fabrication d'engrenages et d'organes mécaniques de transmission,classe
28.21,Fabrication de fours et brûleurs,classe
28.22,Fabrication de matériel de levage et de manutention,classe
28.23,Fabrication de machines et d'équipements de bureau (à l'exception des ordinateurs et équipements périphériques),classe
28.24,Fabrication d'outillage portatif à moteur incorporé,classe
28.25,Fabrication d'équipements aérauliques et frigorifiques industriels,classe
28.29,Fabrication de machines diverses d'usage général,classe
28.3,Fabrication de machines agricoles et forestières,classe
28.41,Fabrication de machines de formage des métaux,classe
28.49,Fabrication d'autres machines-outils,classe
28.91,Fabrication de machines pour la métallurgie,classe
28.92,Fabrication de machines pour l'extraction ou la construction,classe
28.93,Fabrication de machines pour l'industrie agro-alimentaire,classe
28.94,Fabrication de machines pour les industries textiles,classe
28.95,Fabrication de machines pour les industries du papier et du carton,classe
28.96,Fabrication de machines pour le travail du caoutchouc ou des plastiques,classe
28.99,Fabrication d'autres machines d'usage spécifique n.c.a.,classe
29.1,Construction de véhicules automobiles,classe
29.2,Fabrication de carrosseries et remorques,classe
29.31,Fabrication d'équipements électriques et électroniques automobiles,classe
29.32,Fabrication d'autres équipements automobiles,classe
30.11,Construction de navires et de structures flottantes,classe
30.12,Construction de bateaux de plaisance,classe
30.2,Construction de locomotives et d'autre matériel ferroviaire roulant,classe
30.3,Construction aéronautique et spatiale,classe
30.4,Construction de véhicules militaires de combat,classe
30.91,Fabrication de motocycles,classe
30.92,Fabrication de bicyclettes et de véhicules pour invalides,classe
30.99,Fabrication d'autres équipements de transport n.c.a.,classe
31.01,Fabrication de meubles de bureau et de magasin,classe
31.02,Fabrication de meubles de cuisine,classe
31.03,Fabrication de matelas,classe
31.09,Fabrication d'autres meubles,classe
32.11,Frappe de monnaie,classe
32.12,Fabrication d'articles de joaillerie et bijouterie,classe
32.13,Fabrication d'articles de bijouterie fantaisie et articles similaires,classe
32.2,Fabrication d'instruments de musique,classe
32.3,Fabrication d'articles de sport,classe
32.4,Fabrication de jeux et jouets,classe
32.5,Fabrication d'instruments et de fournitures à usage médical et dentaire,classe
32.91,Fabrication d'articles de brosserie,classe
32.99,Autres activités manufacturières n.c.a.,classe
33.11,Réparation d'ouvrages en métaux,classe
33.12,Réparation de machines et équipements mécaniques,classe
33.13,Réparation de matériels électroniques et optiques,classe
33.14,Réparation d'équipements électriques,classe
33.15,Réparation et maintenance navale,classe
33.16,Réparation et maintenance d'aéronefs et d'engins spatiaux,classe
33.17,Réparation et maintenance d'autres équipements de transport,classe
33.19,Réparation d'autres équipements,classe
33.2,Installation de machines et d'équipements industriels,classe
35.11,Production d'électricité,classe
35.12,Transport d'électricité,classe
35.13,Distribution d'électricité,classe
35.14,Commerce d'électricité,classe
35.21,Production de combustibles gazeux,classe
35.22,Distribution de combustibles gazeux par conduites,classe
35.23,Commerce de combustibles gazeux par conduites,classe
35.3,Production et distribution de vapeur et d'air conditionné,classe
36,"Captage, traitement et distribution d'eau",classe
37,Collecte et traitement des eaux usées,classe
38.11,Collecte des déchets non dangereux,classe
38.12,Collecte des déchets dangereux,classe
38.21,Traitement et élimination des déchets non dangereux,classe
38.22,Traitement et élimination des déchets dangereux,classe
38.31,Démantèlement d'épaves,classe
38.32,Récupération de déchets triés,classe
39,Dépollution et autres services de gestion des déchets,classe
41.1,Promotion immobilière,classe
41.2,Construction de bâtiments résidentiels et non résidentiels,classe
42.11,Construction de routes et autoroutes,classe
42.12,Construction de voies ferrées de surface et souterraines,classe
42.13,Construction de ponts et tunnels,classe
42.21,Construction de réseaux pour fluides,classe
42.22,Construction de réseaux électriques et de télécommunications,classe
42.91,Construction d'ouvrages maritimes et fluviaux,classe
42.99,Construction d'autres ouvrages de génie civil n.c.a.,classe
43.11,Travaux de démolition,classe
43.12,Travaux de préparation des sites,classe
43.13,Forages et sondages,classe
43.21,Installation électrique,classe
43.22,Travaux de plomberie et installation de chauffage et de conditionnement d'air,classe
43.29,Autres travaux d'installation,classe
43.31,Travaux de plâtrerie,classe
43.32,Travaux de menuiserie,classe
43.33,Travaux de revêtement des sols et des murs,classe
43.34,Travaux de peinture et vitrerie,classe
43.39,Autres travaux de finition,classe
43.91,Travaux de couverture,classe
43.99,Autres travaux de construction spécialisés n.c.a.,classe
45.11,Commerce de voitures et de véhicules automobiles légers,classe
45.19,Commerce d'autres véhicules automobiles,classe
45.2,Entretien et réparation de véhicules automobiles,classe
45.31,Commerce de gros d'équipements automobiles,classe
45.32,Commerce de détail d'équipements automobiles,classe
45.4,Commerce et réparation de motocycles,classe
46.11,"Intermédiaires du commerce en matières premières agricoles, animaux vivants, matières premières textiles et produits semi-finis",classe
46.12,"Intermédiaires du commerce en combustibles, métaux, minéraux et produits chimiques",classe
46.13,Intermédiaires du commerce en bois et matériaux de construction,classe
46.14,"Intermédiaires du commerce en machines, équipements industriels, navires et avions",classe
46.15,"Intermédiaires du commerce en meubles, articles de ménage et quincaillerie",classe
46.16,"Intermédiaires du commerce en textiles, habillement, fourrures, chaussures et articles en cuir",classe
46.17,"Intermédiaires du commerce en denrées, boissons et tabac",classe
46.18,Intermédiaires spécialisés dans le commerce d'autres produits spécifiques,classe
46.19,Intermédiaires du commerce en produits divers,classe
46.21,"Commerce de gros de céréales, de tabac non manufacturé, de semences et d'aliments pour le bétail",classe
46.22,Commerce de gros de fleurs et plantes,classe
46.23,Commerce de gros d'animaux vivants,classe
46.24,Commerce de gros de cuirs et peaux,classe
46.31,Commerce de gros de fruits et légumes,classe
46.32,Commerce de gros de viandes et de produits à base de viande,classe
46.33,"Commerce de gros de produits laitiers, œufs, huiles et matières grasses comestibles",classe
46.34,Commerce de gros de boissons,classe
46.35,Commerce de gros de produits à base de tabac,classe
46.36,"Commerce de gros de sucre, chocolat et confiserie",classe
46.37,"Commerce de gros de café, thé, cacao et épices",classe
46.38,"Commerce de gros d'autres produits alimentaires, y compris poissons, crustacés et mollusques",classe
46.39,"Commerce de gros non spécialisé de denrées, boissons et tabac",classe
46.41,Commerce de gros de textiles,classe
46.42,Commerce de gros d'habillement et de chaussures,classe
46.43,Commerce de gros d'appareils électroménagers,classe
46.44,"Commerce de gros de vaisselle, verrerie et produits d'entretien",classe
46.45,Commerce de gros de parfumerie et de produits de beauté,classe
46.46,Commerce de gros de produits pharmaceutiques,classe
46.47,"Commerce de gros de meubles, de tapis et d'appareils d'éclairage",classe
46.48,Commerce de gros d'articles d'horlogerie et de bijouterie,classe
46.49,Commerce de gros d'autres biens domestiques,classe
46.51,"Commerce de gros d'ordinateurs, d'équipements informatiques périphériques et de logiciels",classe
46.52,Commerce de gros de composants et d'équipements électroniques et de télécommunication,classe
46.61,Commerce de gros de matériel agricole,classe
46.62,Commerce de gros de machines-outils,classe
46.63,"Commerce de gros de machines pour l'extraction, la construction et le génie civil",classe
46.64,Commerce de gros de machines pour l'industrie textile et l'habillement,classe
46.65,Commerce de gros de mobilier de bureau,classe
46.66,Commerce de gros d'autres machines et équipements de bureau,classe
46.69,Commerce de gros d'autres machines et équipements,classe
46.71,Commerce de gros de combustibles et de produits annexes,classe
46.72,Commerce de gros de minerais et métaux,classe
46.73,"Commerce de gros de bois, de matériaux de construction et d'appareils sanitaires",classe
46.74,Commerce de gros de quincaillerie et fournitures pour plomberie et chauffage,classe
46.75,Commerce de gros de produits chimiques,classe
46.76,Commerce de gros d'autres produits intermédiaires,classe
46.77,Commerce de gros de déchets et débris,classe
46.9,Commerce de gros non spécialisé,classe
47.11,Commerce de détail en magasin non spécialisé à prédominance alimentaire,classe
47.19,Autre commerce de détail en magasin non spécialisé,classe
47.21,Commerce de détail de fruits et légumes en magasin spécialisé,classe
47.22,Commerce de détail de viandes et de produits à base de viande en magasin spécialisé,classe
47.23,"Commerce de détail de poissons, crustacés et mollusques en magasin spécialisé",classe
47.24,"Commerce de détail de pain, pâtisserie et confiserie en magasin spécialisé",classe
47.25,Commerce de détail de boissons en magasin spécialisé,classe
47.26,Commerce de détail de produits à base de tabac en magasin spécialisé,classe
47.29,Autres commerces de détail alimentaires en magasin spécialisé,classe
47.3,Commerce de détail de carburants en magasin spécialisé,classe
47.41,"Commerce de détail d'ordinateurs, d'unités périphériques et de logiciels en magasin spécialisé",classe
47.42,Commerce de détail de matériels de télécommunication en magasin spécialisé,classe
47.43,Commerce de détail de matériels audio/vidéo en magasin spécialisé,classe
47.51,Commerce de détail de textiles en magasin spécialisé,classe
47.52,"Commerce de détail de quincaillerie, peintures et verres en magasin spécialisé",classe
47.53,"Commerce de détail de tapis, moquettes et revêtements de murs et de sols en magasin spécialisé",classe
47.54,Commerce de détail d'appareils électroménagers en magasin spécialisé,classe
47.59,"Commerce de détail de meubles, appareils d'éclairage et autres articles de ménage en magasin spécialisé",classe
47.61,Commerce de détail de livres en magasin spécialisé,classe
47.62,Commerce de détail de journaux et papeterie en magasin spécialisé,classe
47.63,Commerce de détail d'enregistrements musicaux et vidéo en magasin spécialisé,classe
47.64,Commerce de détail d'articles de sport en magasin spécialisé,classe
47.65,Commerce de détail de jeux et jouets en magasin spécialisé,classe
47.71,Commerce de détail d'habillement en magasin spécialisé,classe
47.72,Commerce de détail de chaussures et d'articles en cuir en magasin spécialisé,classe
47.73,Commerce de détail de produits pharmaceutiques en magasin spécialisé,classe
47.74,Commerce de détail d'articles médicaux et orthopédiques en magasin spécialisé,classe
47.75,Commerce de détail de parfumerie et de produits de beauté en magasin spécialisé,classe
47.76,"Commerce de détail de fleurs, plantes, graines, engrais, animaux de compagnie et aliments pour ces animaux en magasin spécialisé",classe
47.77,Commerce de détail d'articles d'horlogerie et de bijouterie en magasin spécialisé,classe
47.78,Autre commerce de détail de biens neufs en magasin spécialisé,classe
47.79,Commerce de détail de biens d'occasion en magasin,classe
47.81,Commerce de détail alimentaire sur éventaires et marchés,classe
47.82,"Commerce de détail de textiles, d'habillement et de chaussures sur éventaires et marchés",classe
47.89,Autres commerces de détail sur éventaires et marchés,classe
47.91,Vente à distance,classe
47.99,"Autres commerces de détail hors magasin, éventaires ou marchés",classe
49.1,Transport ferroviaire interurbain de voyageurs,classe
49.2,Transports ferroviaires de fret,classe
49.31,Transports urbains et suburbains de voyageurs,classe
49.32,Transports de voyageurs par taxis,classe
49.39,Autres transports terrestres de voyageurs n.c.a.,classe
49.41,Transports routiers de fret,classe
49.42,Services de déménagement,classe
49.5,Transports par conduites,classe
50.1,Transports maritimes et côtiers de passagers,classe
50.2,Transports maritimes et côtiers de fret,classe
50.3,Transports fluviaux de passagers,classe
50.4,Transports fluviaux de fret,classe
51.1,Transports aériens de passagers,classe
51.21,Transports aériens de fret,classe
51.22,Transports spatiaux,classe
52.1,Entreposage et stockage,classe
52.21,Services auxiliaires des transports terrestres,classe
52.22,Services auxiliaires des transports par eau,classe
52.23,Services auxiliaires des transports aériens,classe
52.24,Manutention,classe
52.29,Autres services auxiliaires des transports,classe
53.1,Activités de poste dans le cadre d'une obligation de service universel,classe
53.2,Autres activités de poste et de courrier,classe
55.1,Hôtels et hébergement similaire,classe
55.2,Hébergement touristique et autre hébergement de courte durée,classe
55.3,Terrains de camping et parcs pour caravanes ou véhicules de loisirs,classe
55.9,Autres hébergements,classe
56.1,Restaurants et services de restauration mobile,classe
56.21,Services des traiteurs,classe
56.29,Autres services de restauration,classe
56.3,Débits de boissons,classe
58.11,Édition de livres,classe
58.12,Édition de répertoires et de fichiers d'adresses,classe
58.13,Édition de journaux,classe
58.14,Édition de revues et périodiques,classe
58.19,Autres activités d'édition,classe
58.21,Édition de jeux électroniques,classe
58.29,Édition d'autres logiciels,classe
59.11,"Production de films cinématographiques, de vidéo et de programmes de télévision",classe
59.12,"Post-production de films cinématographiques, de vidéo et de programmes de télévision",classe
59.13,"Distribution de films cinématographiques, de vidéo et de programmes de télévision",classe
59.14,Projection de films cinématographiques,classe
59.2,Enregistrement sonore et édition musicale,classe
60.1,Édition et diffusion de programmes radio,classe
60.2,Programmation de télévision et télédiffusion,classe
61.1,Télécommunications filaires,classe
61.2,Télécommunications sans fil,classe
61.3,Télécommunications par satellite,classe
61.9,Autres activités de télécommunication,classe
62.01,Programmation informatique,classe
62.02,Conseil informatique,classe
62.03,Gestion d'installations informatiques,classe
62.09,Autres activités informatiques,classe
63.11,"Traitement de données, hébergement et activités connexes",classe
63.12,Portails Internet,classe
63.91,Activités des agences de presse,classe
63.99,Autres services d'information n.c.a.,classe
64.11,Activités de banque centrale,classe
64.19,Autres intermédiations monétaires,classe
64.2,Activités des sociétés holding,classe
64.3,Fonds de placement et entités financières similaires,classe
64.91,Crédit-bail,classe
64.92,Autre distribution de crédit,classe
64.99,"Autres activités des services financiers, hors assurance et caisses de retraite, n.c.a.",classe
65.11,Assurance vie,classe
65.12,Autres assurances,classe
65.2,Réassurance,classe
65.3,Caisses de retraite,classe
