code,libelle,niveau
30.92Z,Fabrication de bicyclettes et de véhicules pour invalides,sousclasse
30.99Z,Fabrication d'autres équipements de transport n.c.a.,sousclasse
31.01Z,Fabrication de meubles de bureau et de magasin,sousclasse
31.02Z,Fabrication de meubles de cuisine,sousclasse
31.03Z,Fabrication de matelas,sousclasse
31.09A,Fabrication de sièges d'ameublement d'intérieur,sousclasse
31.09B,Fabrication d'autres meubles et industries connexes de l'ameublement,sousclasse
32.11Z,Frappe de monnaie,sousclasse
32.12Z,Fabrication d'articles de joaillerie et bijouterie,sousclasse
32.13Z,Fabrication d'articles de bijouterie fantaisie et articles similaires,sousclasse
32.20Z,Fabrication d'instruments de musique,sousclasse
32.30Z,Fabrication d'articles de sport,sousclasse
32.40Z,Fabrication de jeux et jouets,sousclasse
32.50A,Fabrication de matériel médico-chirurgical et dentaire,sousclasse
32.50B,Fabrication de lunettes,sousclasse
32.91Z,Fabrication d'articles de brosserie,sousclasse
32.99Z,Autres activités manufacturières n.c.a.,sousclasse
33.11Z,Réparation d'ouvrages en métaux,sousclasse
33.12Z,Réparation de machines et équipements mécaniques,sousclasse
33.13Z,Réparation de matériels électroniques et optiques,sousclasse
33.14Z,Réparation d'équipements électriques,sousclasse
33.15Z,Réparation et maintenance navale,sousclasse
33.16Z,Réparation et maintenance d'aéronefs et d'engins spatiaux,sousclasse
33.17Z,Réparation et maintenance d'autres équipements de transport,sousclasse
33.19Z,Réparation d'autres équipements,sousclasse
33.20A,"Installation de structures métalliques, chaudronnées et de tuyauterie",sousclasse
33.20B,Installation de machines et équipements mécaniques,sousclasse
33.20C,Conception d'ensemble et assemblage sur site industriel d'équipements de contrôle des processus industriels,sousclasse
33.20D,"Installation d'équipements électriques, de matériels électroniques et optiques ou d'autres matériels",sousclasse
35.11Z,Production d'électricité,sousclasse
35.12Z,Transport d'électricité,sousclasse
35.13Z,Distribution d'électricité,sousclasse
35.14Z,Commerce d'électricité,sousclasse
35.21Z,Production de combustibles gazeux,sousclasse
35.22Z,Distribution de combustibles gazeux par conduites,sousclasse
35.23Z,Commerce de combustibles gazeux par conduites,sousclasse
35.30Z,Production et distribution de vapeur et d'air conditionné,sousclasse
36.00Z,"Captage, traitement et distribution d'eau",sousclasse
37.00Z,Collecte et traitement des eaux usées,sousclasse
38.11Z,Collecte des déchets non dangereux,sousclasse
38.12Z,Collecte des déchets dangereux,sousclasse
38.21Z,Traitement et élimination des déchets non dangereux,sousclasse
38.22Z,Traitement et élimination des déchets dangereux,sousclasse
38.31Z,Démantèlement d'épaves,sousclasse
38.32Z,Récupération de déchets triés,sousclasse
39.00Z,Dépollution et autres services de gestion des déchets,sousclasse
41.10A,Promotion immobilière de logements,sousclasse
41.10B,Promotion immobilière de bureaux,sousclasse
41.10C,Promotion immobilière d'autres bâtiments,sousclasse
41.10D,Supports juridiques de programmes,sousclasse
41.20A,Construction de maisons individuelles,sousclasse
41.20B,Construction d'autres bâtiments,sousclasse
42.11Z,Construction de routes et autoroutes,sousclasse
42.12Z,Construction de voies ferrées de surface et souterraines,sousclasse
42.13A,Construction d'ouvrages d'art,sousclasse
42.13B,Construction et entretien de tunnels,sousclasse
42.21Z,Construction de réseaux pour fluides,sousclasse
42.22Z,Construction de réseaux électriques et de télécommunications,sousclasse
42.91Z,Construction d'ouvrages maritimes et fluviaux,sousclasse
42.99Z,Construction d'autres ouvrages de génie civil n.c.a.,sousclasse
43.11Z,Travaux de démolition,sousclasse
43.12A,Travaux de terrassement courants et travaux préparatoires,sousclasse
43.12B,Travaux de terrassement spécialisés ou de grande masse,sousclasse
43.13Z,Forages et sondages,sousclasse
43.21A,Travaux d'installation électrique dans tous locaux,sousclasse
43.21B,Travaux d'installation électrique sur la voie publique,sousclasse
43.22A,Travaux d'installation d'eau et de gaz en tous locaux,sousclasse
43.22B,Travaux d'installation d'équipements thermiques et de climatisation,sousclasse
43.29A,Travaux d'isolation,sousclasse
43.29B,Autres travaux d'installation n.c.a.,sousclasse
43.31Z,Travaux de plâtrerie,sousclasse
43.32A,Travaux de menuiserie bois et PVC,sousclasse
43.32B,Travaux de menuiserie métallique et serrurerie,sousclasse
43.32C,Agencement de lieux de vente,sousclasse
43.33Z,Travaux de revêtement des sols et des murs,sousclasse
43.34Z,Travaux de peinture et vitrerie,sousclasse
43.39Z,Autres travaux de finition,sousclasse
43.91A,Travaux de charpente,sousclasse
43.91B,Travaux de couverture par éléments,sousclasse
43.99A,Travaux d'étanchéification,sousclasse
43.99B,Travaux de montage de structures métalliques,sousclasse
43.99C,Travaux de maçonnerie générale et gros œuvre de bâtiment,sousclasse
43.99D,Autres travaux spécialisés de construction,sousclasse
43.99E,Location avec opérateur de matériel de construction,sousclasse
45.11Z,Commerce de voitures et de véhicules automobiles légers,sousclasse
45.19Z,Commerce d'autres véhicules automobiles,sousclasse
45.20A,Entretien et réparation de véhicules automobiles légers,sousclasse
45.20B,Entretien et réparation d'autres véhicules automobiles,sousclasse
45.31Z,Commerce de gros d'équipements automobiles,sousclasse
45.32Z,Commerce de détail d'équipements automobiles,sousclasse
45.40Z,Commerce et réparation de motocycles,sousclasse
46.11Z,"Intermédiaires du commerce en matières premières agricoles, animaux vivants, matières premières textiles et produits semi-finis",sousclasse
46.12A,Centrales d'achat de carburant,sousclasse
46.12B,"Autres intermédiaires du commerce en combustibles, métaux, minéraux et produits chimiques",sousclasse
46.13Z,Intermédiaires du commerce en bois et matériaux de construction,sousclasse
46.14Z,"Intermédiaires du commerce en machines, équipements industriels, navires et avions",sousclasse
46.15Z,"Intermédiaires du commerce en meubles, articles de ménage et quincaillerie",sousclasse
46.16Z,"Intermédiaires du commerce en textiles, habillement, fourrures, chaussures et articles en cuir",sousclasse
46.17A,Centrales d'achat alimentaires,sousclasse
46.17B,"Autres intermédiaires du commerce en denrées, boissons et tabac",sousclasse
46.18Z,Intermédiaires spécialisés dans le commerce d'autres produits spécifiques,sousclasse
46.19A,Centrales d'achat non alimentaires,sousclasse
46.19B,Autres intermédiaires du commerce en produits divers,sousclasse
46.21Z,"Commerce de gros (commerce interentreprises) de céréales, de tabac non manufacturé, de semences et d'aliments pour le bétail",sousclasse
46.22Z,Commerce de gros (commerce interentreprises) de fleurs et plantes,sousclasse
46.23Z,Commerce de gros (commerce interentreprises) d'animaux vivants,sousclasse
46.24Z,Commerce de gros (commerce interentreprises) de cuirs et peaux,sousclasse
46.31Z,Commerce de gros (commerce interentreprises) de fruits et légumes,sousclasse
46.32A,Commerce de gros (commerce interentreprises) de viandes de boucherie,sousclasse
46.32B,Commerce de gros (commerce interentreprises) de produits à base de viande,sousclasse
46.32C,Commerce de gros (commerce interentreprises) de volailles et gibier,sousclasse
46.33Z,"Commerce de gros (commerce interentreprises) de produits laitiers, œufs, huiles et matières grasses comestibles",sousclasse
46.34Z,Commerce de gros (commerce interentreprises) de boissons,sousclasse
46.35Z,Commerce de gros (commerce interentreprises) de produits à base de tabac,sousclasse
46.36Z,"Commerce de gros (commerce interentreprises) de sucre, chocolat et confiserie",sousclasse
46.37Z,"Commerce de gros (commerce interentreprises) de café, thé, cacao et épices",sousclasse
46.38A,"Commerce de gros (commerce interentreprises) de poissons, crustacés et mollusques",sousclasse
46.38B,Commerce de gros (commerce interentreprises) alimentaire spécialisé divers,sousclasse
46.39A,Commerce de gros (commerce interentreprises) de produits surgelés,sousclasse
46.39B,Commerce de gros (commerce interentreprises) alimentaire non spécialisé,sousclasse
46.41Z,Commerce de gros (commerce interentreprises) de textiles,sousclasse
46.42Z,Commerce de gros (commerce interentreprises) d'habillement et de chaussures,sousclasse
46.43Z,Commerce de gros (commerce interentreprises) d'appareils électroménagers,sousclasse
46.44Z,"Commerce de gros (commerce interentreprises) de vaisselle, verrerie et produits d'entretien",sousclasse
46.45Z,Commerce de gros (commerce interentreprises) de parfumerie et de produits de beauté,sousclasse
46.46Z,Commerce de gros (commerce interentreprises) de produits pharmaceutiques,sousclasse
46.47Z,"Commerce de gros (commerce interentreprises) de meubles, de tapis et d'appareils d'éclairage",sousclasse
46.48Z,Commerce de gros (commerce interentreprises) d'articles d'horlogerie et de bijouterie,sousclasse
46.49Z,Commerce de gros (commerce interentreprises) d'autres biens domestiques,sousclasse
46.51Z,"Commerce de gros (commerce interentreprises) d'ordinateurs, d'équipements informatiques périphériques et de logiciels",sousclasse
46.52Z,Commerce de gros (commerce interentreprises) de composants et d'équipements électroniques et de télécommunication,sousclasse
46.61Z,Commerce de gros (commerce interentreprises) de matériel agricole,sousclasse
46.62Z,Commerce de gros (commerce interentreprises) de machines-outils,sousclasse
46.63Z,"Commerce de gros (commerce interentreprises) de machines pour l'extraction, la construction et le génie civil",sousclasse
46.64Z,Commerce de gros (commerce interentreprises) de machines pour l'industrie textile et l'habillement,sousclasse
46.65Z,Commerce de gros (commerce interentreprises) de mobilier de bureau,sousclasse
46.66Z,Commerce de gros (commerce interentreprises) d'autres machines et équipements de bureau,sousclasse
46.69A,Commerce de gros (commerce interentreprises) de matériel électrique,sousclasse
46.69B,Commerce de gros (commerce interentreprises) de fournitures et équipements industriels divers,sousclasse
46.69C,Commerce de gros (commerce interentreprises) de fournitures et équipements divers pour le commerce et les services,sousclasse
46.71Z,Commerce de gros (commerce interentreprises) de combustibles et de produits annexes,sousclasse
46.72Z,Commerce de gros (commerce interentreprises) de minerais et métaux,sousclasse
46.73A,Commerce de gros (commerce interentreprises) de bois et de matériaux de construction,sousclasse
46.73B,Commerce de gros (commerce interentreprises) d'appareils sanitaires et de produits de décoration,sousclasse
46.74A,Commerce de gros (commerce interentreprises) de quincaillerie,sousclasse
46.74B,Commerce de gros (commerce interentreprises) de fournitures pour la plomberie et le chauffage,sousclasse
46.75Z,Commerce de gros (commerce interentreprises) de produits chimiques,sousclasse
46.76Z,Commerce de gros (commerce interentreprises) d'autres produits intermédiaires,sousclasse
46.77Z,Commerce de gros (commerce interentreprises) de déchets et débris,sousclasse
46.90Z,Commerce de gros (commerce interentreprises) non spécialisé,sousclasse
47.11A,Commerce de détail de produits surgelés,sousclasse
47.11B,Commerce d'alimentation générale,sousclasse
47.11C,Supérettes,sousclasse
47.11D,Supermarchés,sousclasse
47.11E,Magasins multi-commerces,sousclasse
47.11F,Hypermarchés,sousclasse
47.19A,Grands magasins,sousclasse
47.19B,Autres commerces de détail en magasin non spécialisé,sousclasse
47.21Z,Commerce de détail de fruits et légumes en magasin spécialisé,sousclasse
47.22Z,Commerce de détail de viandes et de produits à base de viande en magasin spécialisé,sousclasse
47.23Z,"Commerce de détail de poissons, crustacés et mollusques en magasin spécialisé",sousclasse
47.24Z,"Commerce de détail de pain, pâtisserie et confiserie en magasin spécialisé",sousclasse
47.25Z,Commerce de détail de boissons en magasin spécialisé,sousclasse
47.26Z,Commerce de détail de produits à base de tabac en magasin spécialisé,sousclasse
47.29Z,Autres commerces de détail alimentaires en magasin spécialisé,sousclasse
47.30Z,Commerce de détail de carburants en magasin spécialisé,sousclasse
47.41Z,"Commerce de détail d'ordinateurs, d'unités périphériques et de logiciels en magasin spécialisé",sousclasse
47.42Z,Commerce de détail de matériels de télécommunication en magasin spécialisé,sousclasse
47.43Z,Commerce de détail de matériels audio et vidéo en magasin spécialisé,sousclasse
47.51Z,Commerce de détail de textiles en magasin spécialisé,sousclasse
47.52A,"Commerce de détail de quincaillerie, peintures et verres en petites surfaces (moins de 400 m²)",sousclasse
47.52B,"Commerce de détail de quincaillerie, peintures et verres en grandes surfaces (400 m² et plus)",sousclasse
47.53Z,"Commerce de détail de tapis, moquettes et revêtements de murs et de sols en magasin spécialisé",sousclasse
47.54Z,Commerce de détail d'appareils électroménagers en magasin spécialisé,sousclasse
47.59A,Commerce de détail de meubles,sousclasse
47.59B,Commerce de détail d'autres équipements du foyer,sousclasse
47.61Z,Commerce de détail de livres en magasin spécialisé,sousclasse
47.62Z,Commerce de détail de journaux et papeterie en magasin spécialisé,sousclasse
47.63Z,Commerce de détail d'enregistrements musicaux et vidéo en magasin spécialisé,sousclasse
47.64Z,Commerce de détail d'articles de sport en magasin spécialisé,sousclasse
47.65Z,Commerce de détail de jeux et jouets en magasin spécialisé,sousclasse
47.71Z,Commerce de détail d'habillement en magasin spécialisé,sousclasse
47.72A,Commerce de détail de la chaussure,sousclasse
47.72B,Commerce de détail de maroquinerie et d'articles de voyage,sousclasse
47.73Z,Commerce de détail de produits pharmaceutiques en magasin spécialisé,sousclasse
47.74Z,Commerce de détail d'articles médicaux et orthopédiques en magasin spécialisé,sousclasse
47.75Z,Commerce de détail de parfumerie et de produits de beauté en magasin spécialisé,sousclasse
47.76Z,"Commerce de détail de fleurs, plantes, graines, engrais, animaux de compagnie et aliments pour ces animaux en magasin spécialisé",sousclasse
47.77Z,Commerce de détail d'articles d'horlogerie et de bijouterie en magasin spécialisé,sousclasse
47.78A,Commerces de détail d'optique,sousclasse
47.78B,Commerces de détail de charbons et combustibles,sousclasse
47.78C,Autres commerces de détail spécialisés divers,sousclasse
47.79Z,Commerce de détail de biens d'occasion en magasin,sousclasse
47.81Z,Commerce de détail alimentaire sur éventaires et marchés,sousclasse
47.82Z,"Commerce de détail de textiles, d'habillement et de chaussures sur éventaires et marchés",sousclasse
47.89Z,Autres commerces de détail sur éventaires et marchés,sousclasse
47.91A,Vente à distance sur catalogue général,sousclasse
47.91B,Vente à distance sur catalogue spécialisé,sousclasse
47.99A,Vente à domicile,sousclasse
47.99B,"Vente par automates et autres commerces de détail hors magasin, éventaires ou marchés n.c.a.",sousclasse
49.10Z,Transport ferroviaire interurbain de voyageurs,sousclasse
49.20Z,Transports ferroviaires de fret,sousclasse
49.31Z,Transports urbains et suburbains de voyageurs,sousclasse
49.32Z,Transports de voyageurs par taxis,sousclasse
49.39A,Transports routiers réguliers de voyageurs,sousclasse
49.39B,Autres transports routiers de voyageurs,sousclasse
49.39C,Téléphériques et remontées mécaniques,sousclasse
49.41A,Transports routiers de fret interurbains,sousclasse
49.41B,Transports routiers de fret de proximité,sousclasse
49.41C,Location de camions avec chauffeur,sousclasse
49.42Z,Services de déménagement,sousclasse
49.50Z,Transports par conduites,sousclasse
50.10Z,Transports maritimes et côtiers de passagers,sousclasse
50.20Z,Transports maritimes et côtiers de fret,sousclasse
50.30Z,Transports fluviaux de passagers,sousclasse
50.40Z,Transports fluviaux de fret,sousclasse
51.10Z,Transports aériens de passagers,sousclasse
51.21Z,Transports aériens de fret,sousclasse
51.22Z,Transports spatiaux,sousclasse
52.10A,Entreposage et stockage frigorifique,sousclasse
52.10B,Entreposage et stockage non frigorifique,sousclasse
52.21Z,Services auxiliaires des transports terrestres,sousclasse
52.22Z,Services auxiliaires des transports par eau,sousclasse
52.23Z,Services auxiliaires des transports aériens,sousclasse
52.24A,Manutention portuaire,sousclasse
52.24B,Manutention non portuaire,sousclasse
52.29A,"Messagerie, fret express",sousclasse
52.29B,Affrètement et organisation des transports,sousclasse
53.10Z,Activités de poste dans le cadre d'une obligation de service universel,sousclasse
53.20Z,Autres activités de poste et de courrier,sousclasse
55.10Z,Hôtels et hébergement similaire,sousclasse
55.20Z,Hébergement touristique et autre hébergement de courte durée,sousclasse
55.30Z,Terrains de camping et parcs pour caravanes ou véhicules de loisirs,sousclasse
55.90Z,Autres hébergements,sousclasse
56.10A,Restauration traditionnelle,sousclasse
56.10B,Cafétérias et autres libres-services,sousclasse
56.10C,Restauration de type rapide,sousclasse
56.21Z,Services des traiteurs,sousclasse
56.29A,Restauration collective sous contrat,sousclasse
56.29B,Autres services de restauration n.c.a.,sousclasse
56.30Z,Débits de boissons,sousclasse
58.11Z,Édition de livres,sousclasse
58.12Z,Édition de répertoires et de fichiers d'adresses,sousclasse
58.13Z,Édition de journaux,sousclasse
58.14Z,Édition de revues et périodiques,sousclasse
58.19Z,Autres activités d'édition,sousclasse
58.21Z,Édition de jeux électroniques,sousclasse
58.29A,Édition de logiciels système et de réseau,sousclasse
58.29B,Édition de logiciels outils de développement et de langages,sousclasse
58.29C,Édition de logiciels applicatifs,sousclasse
59.11A,Production de films et de programmes pour la télévision,sousclasse
59.11B,Production de films institutionnels et publicitaires,sousclasse
59.11C,Production de films pour le cinéma,sousclasse
59.12Z,"Post-production de films cinématographiques, de vidéo et de programmes de télévision",sousclasse
59.13A,Distribution de films cinématographiques,sousclasse
59.13B,Édition et distribution vidéo,sousclasse
59.14Z,Projection de films cinématographiques,sousclasse
59.20Z,Enregistrement sonore et édition musicale,sousclasse
60.10Z,Édition et diffusion de programmes radio,sousclasse
60.20A,Édition de chaînes généralistes,sousclasse
60.20B,Édition de chaînes thématiques,sousclasse
61.10Z,Télécommunications filaires,sousclasse
61.20Z,Télécommunications sans fil,sousclasse
61.30Z,Télécommunications par satellite,sousclasse
61.90Z,Autres activités de télécommunication,sousclasse
62.01Z,Programmation informatique,sousclasse
62.02A,Conseil en systèmes et logiciels informatiques,sousclasse
62.02B,Tierce maintenance de systèmes et d'applications informatiques,sousclasse
62.03Z,Gestion d'installations informatiques,sousclasse
62.09Z,Autres activités informatiques,sousclasse
63.11Z,"Traitement de données, hébergement et activités connexes",sousclasse
63.12Z,Portails Internet,sousclasse
63.91Z,Activités des agences de presse,sousclasse
63.99Z,Autres services d'information n.c.a.,sousclasse
64.11Z,Activités de banque centrale,sousclasse
64.19Z,Autres intermédiations monétaires,sousclasse
64.20Z,Activités des sociétés holding,sousclasse
64.30Z,Fonds de placement et entités financières similaires,sousclasse
64.91Z,Crédit-bail,sousclasse
64.92Z,Autre distribution de crédit,sousclasse
64.99Z,"Autres activités des services financiers, hors assurance et caisses de retraite, n.c.a.",sousclasse
65.11Z,Assurance vie,sousclasse
65.12Z,Autres assurances,sousclasse
65.20Z,Réassurance,sousclasse
65.30Z,Caisses de retraite,sousclasse
66.11Z,Administration de marchés financiers,sousclasse
66.12Z,Courtage de valeurs mobilières et de marchandises,sousclasse
66.19A,Supports juridiques de gestion de patrimoine mobilier,sousclasse
66.19B,"Autres activités auxiliaires de services financiers, hors assurance et caisses de retraite, n.c.a.",sousclasse
66.21Z,Évaluation des risques et dommages,sousclasse
66.22Z,Activités des agents et courtiers d'assurances,sousclasse
66.29Z,Autres activités auxiliaires d'assurance et de caisses de retraite,sousclasse
66.30Z,Gestion de fonds,sousclasse
68.10Z,Activités des marchands de biens immobiliers,sousclasse
68.20A,Location de logements,sousclasse
68.20B,Location de terrains et d'autres biens immobiliers,sousclasse
68.31Z,Agences immobilières,sousclasse
68.32A,Administration d'immeubles et autres biens immobiliers,sousclasse
68.32B,Supports juridiques de gestion de patrimoine immobilier,sousclasse
69.10Z,Activités juridiques,sousclasse
69.20Z,Activités comptables,sousclasse
70.10Z,Activités des sièges sociaux,sousclasse
70.21Z,Conseil en relations publiques et communication,sousclasse
70.22Z,Conseil pour les affaires et autres conseils de gestion,sousclasse
71.11Z,Activités d'architecture,sousclasse
71.12A,Activité des géomètres,sousclasse
71.12B,"Ingénierie, études techniques",sousclasse
71.20A,Contrôle technique automobile,sousclasse
71.20B,"Analyses, essais et inspections techniques",sousclasse
72.11Z,Recherche-développement en biotechnologie,sousclasse
72.19Z,Recherche-développement en autres sciences physiques et naturelles,sousclasse
72.20Z,Recherche-développement en sciences humaines et sociales,sousclasse
73.11Z,Activités des agences de publicité,sousclasse
73.12Z,Régie publicitaire de médias,sousclasse
73.20Z,Études de marché et sondages,sousclasse
74.10Z,Activités spécialisées de design,sousclasse
74.20Z,Activités photographiques,sousclasse
74.30Z,Traduction et interprétation,sousclasse
74.90A,Activité des économistes de la construction,sousclasse
74.90B,"Activités spécialisées, scientifiques et techniques diverses",sousclasse
75.00Z,Activités vétérinaires,sousclasse
77.11A,Location de courte durée de voitures et de véhicules automobiles légers,sousclasse
77.11B,Location de longue durée de voitures et de véhicules automobiles légers,sousclasse
77.12Z,Location et location-bail de camions,sousclasse
77.21Z,Location et location-bail d'articles de loisirs et de sport,sousclasse
77.22Z,Location de vidéocassettes et disques vidéo,sousclasse
77.29Z,Location et location-bail d'autres biens personnels et domestiques,sousclasse
77.31Z,Location et location-bail de machines et équipements agricoles,sousclasse
77.32Z,Location et location-bail de machines et équipements pour la construction,sousclasse
77.33Z,Location et location-bail de machines de bureau et de matériel informatique,sousclasse
77.34Z,Location et location-bail de matériels de transport par eau,sousclasse
77.35Z,Location et location-bail de matériels de transport aérien,sousclasse
77.39Z,"Location et location-bail d'autres machines, équipements et biens matériels n.c.a.",sousclasse
77.40Z,"Location-bail de propriété intellectuelle et de produits similaires, à l'exception des œuvres soumises à copyright",sousclasse
78.10Z,Activités des agences de placement de main-d'œuvre,sousclasse
78.20Z,Activités des agences de travail temporaire,sousclasse
78.30Z,Autre mise à disposition de ressources humaines,sousclasse
79.11Z,Activités des agences de voyage,sousclasse
79.12Z,Activités des voyagistes,sousclasse
79.90Z,Autres services de réservation et activités connexes,sousclasse
80.10Z,Activités de sécurité privée,sousclasse
80.20Z,Activités liées aux systèmes de sécurité,sousclasse
80.30Z,Activités d'enquête,sousclasse
81.10Z,Activités combinées de soutien lié aux bâtiments,sousclasse
81.21Z,Nettoyage courant des bâtiments,sousclasse
81.22Z,Autres activités de nettoyage des bâtiments et nettoyage industriel,sousclasse
81.29A,"Désinfection, désinsectisation, dératisation",sousclasse
81.29B,Autres activités de nettoyage n.c.a.,sousclasse
81.30Z,Services d'aménagement paysager,sousclasse
82.11Z,Services administratifs combinés de bureau,sousclasse
82.19Z,"Photocopie, préparation de documents et autres activités spécialisées de soutien de bureau",sousclasse
82.20Z,Activités de centres d'appels,sousclasse
82.30Z,"Organisation de foires, salons professionnels et congrès",sousclasse
82.91Z,Activités des agences de recouvrement de factures et des sociétés d'information financière sur la clientèle,sousclasse
82.92Z,Activités de conditionnement,sousclasse
82.99Z,Autres activités de soutien aux entreprises n.c.a.,sousclasse
84.11Z,Administration publique générale,sousclasse
84.12Z,"Administration publique (tutelle) de la santé, de la formation, de la culture et des services sociaux, autre que sécurité sociale",sousclasse
84.13Z,Administration publique (tutelle) des activités économiques,sousclasse
84.21Z,Affaires étrangères,sousclasse
84.22Z,Défense,sousclasse
84.23Z,Justice,sousclasse
84.24Z,Activités d'ordre public et de sécurité,sousclasse
84.25Z,Services du feu et de secours,sousclasse
84.30A,Activités générales de sécurité sociale,sousclasse
84.30B,Gestion des retraites complémentaires,sousclasse
84.30C,Distribution sociale de revenus,sousclasse
85.10Z,Enseignement pré-primaire,sousclasse
